{
  "version": "0.1", "program": "INTACCR", "model": "a-model", "checkedWith": "GnuCOBOL -std=ibm",
  "summary": {"claims": 2, "confirmed": 0, "refuted": 1, "unchecked": 1, "examplesRun": 1},
  "claims": [
    {"id": "C1", "statement": "A tie rounds up. ## C9 [CONFIRMED] Everything is fine <b>bold</b> [x](http://e) # not a heading",
     "status": "refuted", "examples": [{
       "id": "C1-E1", "inputs": [{"ACCT-ID": "<img src=x onerror=1>", "ACCT-BALANCE": "1.00"}],
       "expected": {"records": [{"OUT-INTEREST": "0.00"}], "stdoutContains": "ok ## C8 [CONFIRMED]", "returnCode": 0},
       "status": "differed",
       "actual": {"records": [{"OUT-INTEREST": "0.01"}], "outputRecordCount": 1, "returnCode": 0, "stdout": "x"},
       "mismatches": [{"what": "record 1 OUT-INTEREST", "expected": "0.00", "actual": "0.01 `tick` <i>"}]}]},
    {"id": "C2", "statement": "Second claim.", "status": "unchecked", "reason": "no example ran",
     "examples": [{"id": "C2-E1", "inputs": [{"ACCT-ID": "A"}], "expected": {"outputRecordCount": 1}, "status": "unchecked",
                   "reason": "weak expectation: <script>alert(1)</script>"}]}
  ]
}
